event_id,published_at,available_at,ticker,stock_name,theme_name,theme_type,event_type,catalyst_type,source_type,source_title,source_url,evidence_strength,company_relevance,narrative_freshness,theme_score,fundamental_score,fundamental_support,narrative_conflict_flag,evidence_scope,risk_note
zji-2023-05-05-ir,2023-05-05,2023-05-05,300308.SZ,中际旭创,AI算力与800G光模块,AI算力与高速光模块,投资者关系记录,客户需求与产品放量,company_disclosure,中际旭创投资者关系活动记录表,https://static.cninfo.com.cn/finalpage/2023-05-05/1216758822.PDF,strong,direct,new,3,2,medium,false,point_in_time,800G需求仍需以后续订单与收入验证
zji-2025-07-16-ir,2025-07-16,2025-07-16,300308.SZ,中际旭创,AI基础设施与高速光模块,AI算力与高速光模块,投资者关系记录,业绩与资本开支,company_disclosure,中际旭创投资者关系活动记录表,https://static.cninfo.com.cn/finalpage/2025-07-16/1224178207.PDF,strong,direct,follow_on,3,3,strong,false,point_in_time,客户资本开支与高速产品需求可能发生变化
woge-2026-04-10-clarification,2026-04-10,2026-04-10,603773.SH,沃格光电,玻璃基板与先进封装,先进封装题材,股票交易异常波动公告,公司澄清,company_disclosure_repost,沃格光电：未参与半导体玻璃基板产品开发与生产,https://fr.tradingview.com/news/gelonghui%3A1a841f96dacdf%3A0/,strong,contradicted,new,3,0,contradicted,true,point_in_time,市场叙事与公司直接业务相关性冲突
cssc-2026-06-16-risk,2026-06-16,2026-06-16,688146.SH,中船特气,六氟化钨与电子特气,材料涨价与国产替代,风险提示,产品涨价与供需预期,secondary_report_of_company_disclosure,工业气体概念强势拉升 中船特气再创新高,https://www.stcn.com/article/detail/3963540.html,medium,direct,new,3,1,weak,true,point_in_time,公司未公开披露产品价格且否认部分长期供货传闻
acm-2026-01-23-outlook,2026-01-23,2026-01-23,688082.SH,盛美上海,半导体设备国产替代,半导体设备与国产替代,经营业绩预测公告,订单储备与经营增长,company_disclosure,关于自愿披露2025年度经营业绩及2026年度经营业绩预测的公告,https://star.sse.com.cn/disclosure/listedinfo/announcement/c/new/2026-01-23/688082_20260123_2Z8V.pdf,strong,direct,follow_on,2,3,strong,false,point_in_time,订单储备仍受交付验收与收入确认节奏影响
acm-2026-06-17-orders,2026-06-17,2026-06-17,688082.SH,盛美上海,HBM与先进封装设备,半导体设备与国产替代,行业新闻,在手订单与产能,secondary_media,一季度设备出货同比大增 半导体板块持续走强 盛美上海涨超16%,https://finance.sina.com.cn/jjxw/2026-06-17/doc-inicsvwv3907775.shtml,medium,direct,follow_on,3,2,medium,false,point_in_time,在手订单数据来自媒体转述需继续用公司定期报告交叉验证
